datos/Asus/resumen.csv

experiment,filter,resolution,mask_size,threads_per_block,blocks,cpu_median,cpu_std,h2d_median,kernel_median,kernel_std,d2h_median,total_median,total_std,speedup_kernel,speedup_total,transfer_percent,max_abs_error,mean_abs_error,valid
exp1,media,4000x4000,3,256,62500,97.569438,1.823382,5.290400,0.704256,0.000492,5.395968,11.390880,0.162277,138.542573,8.565575,93.8151,4.57764e-05,1.93399e-06,SI
exp1,nitidez,4000x4000,3,256,62500,98.743035,1.940720,5.294528,0.706560,0.005163,5.510912,11.467808,0.296534,139.751801,8.610454,94.2241,0,0,SI
exp1,laplaciano,4000x4000,3,256,62500,97.753466,1.703897,5.256992,0.704320,0.000532,5.366848,11.327328,0.213097,138.791266,8.629879,93.7895,0,0,SI
exp2,media,2000x2000,9,256,15625,194.303853,3.214064,1.410048,0.995168,0.001309,1.394784,3.893408,0.085515,195.247294,49.905854,72.0405,0.000167847,3.71361e-06,SI
exp2,media,4000x4000,9,256,62500,779.593113,26.296049,5.267840,3.928064,0.003978,6.907168,16.112256,0.147612,198.467513,48.385100,75.5636,0.000167847,3.58354e-06,SI
exp2,media,6000x6000,9,256,140625,1759.294572,52.177636,11.476096,8.800256,0.003992,12.184512,32.458817,2.124132,199.914027,54.200823,72.8942,0.000167847,3.52543e-06,SI
exp3,media,4000x4000,3,256,62500,98.929007,0.828982,5.311040,0.702400,0.000726,7.063328,12.986816,0.120678,140.844253,7.617649,95.2841,4.57764e-05,1.93399e-06,SI
exp3,media,4000x4000,9,256,62500,784.550306,13.003958,5.302976,3.923968,0.000589,6.997504,16.224288,0.357805,199.937994,48.356531,75.8152,0.000167847,3.58354e-06,SI
exp3,media,4000x4000,21,256,62500,4453.989238,34.355054,5.187104,20.801537,0.004835,6.867744,32.881729,0.148450,214.118280,135.454838,36.6612,0.00012207,2.74775e-06,SI
exp4,media,4000x4000,9,128,125000,784.499969,1.558789,5.234560,3.912704,0.004320,6.941120,16.088000,0.076279,200.500720,48.763051,75.6818,0.000167847,3.58354e-06,SI
exp4,media,4000x4000,9,256,62500,785.145389,4.343273,5.247776,3.921920,0.000471,6.938560,16.091136,0.126276,200.194134,48.793657,75.7332,0.000167847,3.58354e-06,SI
exp4,media,4000x4000,9,512,31250,786.144507,19.452295,5.271136,3.973824,0.000434,6.958208,16.199616,0.096293,197.830730,48.528589,75.4916,0.000167847,3.58354e-06,SI

datos/Asus/raw_output.md

=== EXPERIMENTO 2: RESOLUCION ===
exp2 | media 9x9 | 2000x2000 | 256 hilos/bloque: CPU 194.30 ms | Kernel 0.995 ms | Total 3.89 ms | Speedup Ker: 195.25x
exp2 | media 9x9 | 4000x4000 | 256 hilos/bloque: CPU 779.59 ms | Kernel 3.928 ms | Total 16.11 ms | Speedup Ker: 198.47x
exp2 | media 9x9 | 6000x6000 | 256 hilos/bloque: CPU 1759.29 ms | Kernel 8.800 ms | Total 32.46 ms | Speedup Ker: 199.91x